{
  "venue_id": "ninety-one",
  "venue_name": "Ninety One",
  "aspect": "facts",
  "researched_at": "2026-10-14T22:00:00Z",
  "findings": [
    {
      "field": "address",
      "value": "91 Brick Lane, Spitalfields, London",
      "source_date": null,
      "evidence": [
        {
          "fields": ["address", "postcode"],
          "url": "https://camra.org.uk/pubs/ninety-one-london-155038",
          "quote": "91 Brick Lane, Spitalfields, London, E1 6QL",
          "retrieved_at": "2026-10-14T21:58:00Z",
          "source_kind": "directory"
        }
      ]
    },
    {
      "field": "postcode",
      "value": "E1 6QL",
      "source_date": null,
      "evidence": [
        {
          "fields": ["postcode"],
          "url": "https://camra.org.uk/pubs/ninety-one-london-155038",
          "quote": "91 Brick Lane, Spitalfields, London, E1 6QL",
          "retrieved_at": "2026-10-14T21:58:00Z",
          "source_kind": "directory"
        }
      ]
    },
    {
      "field": "accessibility.step_free",
      "value": false,
      "source_date": null,
      "evidence": [
        {
          "fields": ["accessibility.step_free"],
          "url": "https://camra.org.uk/pubs/ninety-one-london-155038",
          "quote": "Steps at entrance. No accessible toilet.",
          "retrieved_at": "2026-10-14T21:58:00Z",
          "source_kind": "directory"
        }
      ]
    },
    {
      "field": "accessibility.accessible_toilet",
      "value": false,
      "source_date": null,
      "evidence": [
        {
          "fields": ["accessibility.accessible_toilet"],
          "url": "https://camra.org.uk/pubs/ninety-one-london-155038",
          "quote": "Steps at entrance. No accessible toilet.",
          "retrieved_at": "2026-10-14T21:58:00Z",
          "source_kind": "directory"
        }
      ]
    }
  ],
  "not_found": [
    "website",
    "access_page",
    "accessibility.hearing_loop",
    "age_policy",
    "capacity",
    "cost.free_entry",
    "cost.notes"
  ],
  "notes": "The access statement is from CAMRA's WhatPub entry, which shows no date, so the checker should confirm it with the venue before it is published. CAMRA lists the pub as 'Ninety One Living Room', at the same address as the lead's 'Ninety One'. No own website was found in one search. The lead's Friday live-and-DJ nights come from an aggregator and are not used here."
}
