{
  "venue_id": "herald-st",
  "venue_name": "Herald St",
  "aspect": "facts",
  "researched_at": "2026-10-13T00:11:02Z",
  "findings": [
    {
      "field": "address",
      "value": "2 Herald St, London",
      "source_date": null,
      "evidence": [
        {
          "fields": [
            "address"
          ],
          "url": "https://www.heraldst.com/contact",
          "quote": "2 Herald St London E2 6JT",
          "retrieved_at": "2026-10-13T00:11:02Z",
          "source_kind": "primary"
        }
      ]
    },
    {
      "field": "postcode",
      "value": "E2 6JT",
      "source_date": null,
      "evidence": [
        {
          "fields": [
            "postcode"
          ],
          "url": "https://www.heraldst.com/contact",
          "quote": "2 Herald St London E2 6JT",
          "retrieved_at": "2026-10-13T00:11:02Z",
          "source_kind": "primary"
        }
      ]
    },
    {
      "field": "website",
      "value": "https://www.heraldst.com",
      "source_date": null,
      "evidence": [
        {
          "fields": [
            "website"
          ],
          "url": "https://www.heraldst.com/contact",
          "quote": "Contemporary art gallery with three premises across London and Bologna.",
          "retrieved_at": "2026-10-13T00:11:02Z",
          "source_kind": "primary"
        }
      ]
    }
  ],
  "not_found": [
    "accessibility.step_free",
    "accessibility.accessible_toilet",
    "accessibility.hearing_loop",
    "accessibility.notes",
    "accessibility.access_page",
    "cost.free_entry",
    "cost.notes",
    "age_policy",
    "capacity"
  ],
  "notes": "No access statement on heraldst.com: the home and contact pages have none, and /visit, /info, /access and /accessibility are 404. Gallery hours are on the contact page (11-6 Tuesday to Saturday, or by appointment). The Museum St and Bologna premises are not part of this record."
}
